{
  "checkpoint_id": "ckpt-run-2026-10-07-001-0007",
  "run_id": "run-2026-10-07-001",
  "thread_id": "run-2026-10-07-001",
  "parent_checkpoint_id": "ckpt-run-2026-10-07-001-0006",
  "node": "G4",
  "created_at": "2026-10-07T10:30:00+08:00",
  "state_sha256": "sha256:97a52e63bcd266f3ac749b21ca0f34a4173820ffac8a4d7230d8e6f48d9427ad",
  "schema_version": "0.5",
  "run_status": "ABORTED",
  "pending_interrupt": null,
  "encrypted": true,
  "authoritative": false
}
