{
  "checkpoint_id": "ckpt-run-2026-10-07-001-0007",
  "run_id": "run-2026-10-07-001",
  "thread_id": "run-2026-10-07-001",
  "parent_checkpoint_id": "ckpt-run-2026-10-07-001-0006",
  "node": "G4",
  "created_at": "2026-10-07T10:30:00+08:00",
  "state_sha256": "sha256:8cc8d88b6a3af389a83597f387575739acd111fba50722f37454b81a42b5ad24",
  "schema_version": "0.5",
  "run_status": "SUSPENDED",
  "pending_interrupt": {
    "kind": "gate",
    "gate": "G4",
    "subject_hash": "sha256:fedf098de9d6e878229462390a339cf3b8bb6df486033b161949b48e9e7779ba",
    "deadline": "2026-10-10T10:30:00+08:00"
  },
  "encrypted": true,
  "authoritative": false
}
